{
  "$schema": "https://json-schema.org/draft/2020-12/schema",
  "$id": "https://models.geonicdb.com/schema/task/Project/v1.0.0.json",
  "title": "Project",
  "description": "A grouping of tasks: a Redmine project, a GitHub repository, one disaster-response operation. Called differently in different settings, with the same common attributes.",
  "x-version": "1.0.0",
  "x-license-url": "https://models.geonicdb.com/LICENSE-CONTENT",
  "x-model-tags": "GeonicDB, task management, GTT",
  "x-derived-from": "https://www.rfc-editor.org/rfc/rfc8984.html",
  "type": "object",
  "properties": {
    "id": {
      "type": "string",
      "format": "uri",
      "description": "Entity id (URN)"
    },
    "type": {
      "type": "string",
      "const": "Project",
      "description": "Entity type"
    },
    "name": {
      "type": "string",
      "description": "Name or subject",
      "x-ngsi": {
        "type": "Property"
      },
      "x-iri": "https://uri.etsi.org/ngsi-ld/name"
    },
    "description": {
      "type": "string",
      "description": "Description",
      "x-ngsi": {
        "type": "Property"
      },
      "x-iri": "https://uri.etsi.org/ngsi-ld/v1/ngsi-ld-core-context-v1.8.jsonld#description"
    },
    "identifier": {
      "type": "string",
      "description": "Short handle (Redmine identifier, GitHub owner/repo)",
      "x-ngsi": {
        "type": "Property"
      },
      "x-iri": "https://schema.org/identifier"
    },
    "parent": {
      "type": "string",
      "format": "uri",
      "description": "Parent project",
      "x-ngsi": {
        "type": "Relationship",
        "target": "https://models.geonicdb.com/ns/task/Project"
      },
      "x-iri": "https://models.geonicdb.com/ns/task/parent"
    },
    "projectStatus": {
      "type": "string",
      "enum": [
        "active",
        "closed",
        "archived"
      ],
      "description": "State; status is protected in the core context, hence projectStatus",
      "x-ngsi": {
        "type": "Property"
      },
      "x-iri": "https://models.geonicdb.com/ns/task/projectStatus"
    },
    "isPublic": {
      "type": "boolean",
      "description": "true when public",
      "x-ngsi": {
        "type": "Property"
      },
      "x-iri": "https://models.geonicdb.com/ns/task/isPublic"
    },
    "homepage": {
      "type": "string",
      "format": "uri",
      "description": "Homepage",
      "x-ngsi": {
        "type": "Property"
      },
      "x-iri": "https://schema.org/url"
    },
    "start": {
      "type": "string",
      "format": "date-time",
      "description": "Planned start",
      "x-ngsi": {
        "type": "Property"
      },
      "x-iri": "https://models.geonicdb.com/ns/task/start"
    },
    "end": {
      "type": "string",
      "format": "date-time",
      "description": "Planned end",
      "x-ngsi": {
        "type": "Property"
      },
      "x-iri": "https://models.geonicdb.com/ns/task/end"
    },
    "location": {
      "type": "object",
      "required": [
        "type"
      ],
      "properties": {
        "type": {
          "enum": [
            "Point",
            "LineString",
            "Polygon",
            "MultiPoint",
            "MultiLineString",
            "MultiPolygon",
            "GeometryCollection"
          ]
        },
        "coordinates": {
          "type": "array"
        },
        "geometries": {
          "type": "array"
        }
      },
      "description": "Location as any GeoJSON geometry: point, line, polygon or a collection",
      "x-ngsi": {
        "type": "GeoProperty",
        "model": "https://purl.org/geojson/vocab#Geometry"
      },
      "x-iri": "https://uri.etsi.org/ngsi-ld/v1/ngsi-ld-core-context-v1.8.jsonld#location"
    },
    "keywords": {
      "type": "array",
      "items": {
        "type": "string"
      },
      "description": "Keywords or labels",
      "x-ngsi": {
        "type": "Property"
      },
      "x-iri": "https://schema.org/keywords"
    },
    "source": {
      "type": "string",
      "format": "uri",
      "description": "URL of this object in the system of record",
      "x-ngsi": {
        "type": "Property"
      },
      "x-iri": "https://smart-data-models.github.io/data-models/terms.jsonld#/definitions/source"
    },
    "externalId": {
      "type": "string",
      "description": "Identifier in the system of record",
      "x-ngsi": {
        "type": "Property"
      },
      "x-iri": "https://models.geonicdb.com/ns/task/externalId"
    },
    "dateCreated": {
      "type": "string",
      "format": "date-time",
      "description": "Creation time in the system of record (distinct from the broker attribute createdAt)",
      "x-ngsi": {
        "type": "Property"
      },
      "x-iri": "https://smart-data-models.github.io/data-models/terms.jsonld#/definitions/dateCreated"
    },
    "dateModified": {
      "type": "string",
      "format": "date-time",
      "description": "Last modification time in the system of record",
      "x-ngsi": {
        "type": "Property"
      },
      "x-iri": "https://smart-data-models.github.io/data-models/terms.jsonld#/definitions/dateModified"
    }
  },
  "required": [
    "id",
    "type",
    "name"
  ],
  "additionalProperties": false
}
